 me ,,,,,,
69,"Just like The Penguins, the Moonglows
The Orioles, the Five Satins
The easy stream of laughter
Flowing through the air
Rene and Georgette Magritte
With their dog apres la guerre",Rene and Georgette Magritte with their Dog After The War,Hearts and Bones,,1980s,1983
70,"He had no friends, he seldom spoke
And no one in turn ever spoke to him
'Cause he wasn't friendly and he didn't care
And he wasn't like them
Oh, no, he was a most peculiar man",A Most Peculiar Man,Sounds of Silence. Simon & Garfunkel,https://youtu.be/N7CWpcmPkVk?t=59,1960s,1966
71,"Where have you gone, Joe DiMaggio?
Our nation turns its lonely eyes to you
Woo, woo, woo
What's that you say, Mrs. Robinson?
Joltin' Joe has left and gone away
Hey, hey, hey",DOUBLE FEATURE Mrs. Robinson,"From The Graduate, Yankee Stadium on DiMaggio Day in 1999",https://youtu.be/nkXyreJV604?t=180   https://youtu.be/07b-WtWT2BA?t=146,1960s,1968
72,"Hey, Schoolgirl in the second row
The teacher's lookin' over
So I got to whisper way down low
To say, ""Who-bop-a-loo-chi-bop, let's meet
After school at three.""","Hey, Schoolgirl",As Tom & Jerry,https://youtu.be/ATEX5lDgAhQ?si=OFfkneFWORifvzB8&t=57,1950s,1957
73,"Cloudy
My thoughts are scattered and they're cloudy
They have no borders, no boundaries
They echo and they swell
From Tolstoy to Tinker Bell
Down from Berkeley to Carmel
Got some pictures in my pocket and a lot of time to kill",Cloudy,Sung by Simon & Garfunkel Paul Simon & Bruce Woodley,https://youtu.be/545ih5ygngs?si=y6ENGLfw2NNNcXMZ&t=46,1960s,1966
74,"There were three men down
And the season lost
And the tarpaulin was rolled
Upon the winter frost",Night Game,Still Crazy After All These Years,https://youtu.be/yUSG_9VT6oM?si=SjeOflRodVBTxFgu&t=77,1970s,1975