,Uploaded (decade),Uploaded (genre),Songs Potpourri,Lyrix,Song name,Artist,Youtube Link,Decade,Genre,Year,Contributed by
934,,,73,"Dynamite's in the belfry, baby, playin' with the bats
Little gun's downtown in front of Woolworth's tryin' out his attitude on all the cats
Papa's on the corner, waitin' for the bus
Mama, she's home in the window, waitin' up for us
She'll be there in that chair when they wrestle her upstairs
'Cause you know we ain't gonna come
I ain't here on business, baby, I'm only here for fun
And Rosie, you're the one",Rosalita,Bruce Springsteen,https://youtu.be/CYHGh6lmSbo?t=60,1970s,Rock,1973,
935,,,74,"Well, hot and heavy, pumpkin pie
Chocolate candy, Jesus Christ
Ain't nothing please me more than you",Home,Edward Sharpe and the Magnetic Zeros,https://youtu.be/DHEOF_rcND8?t=43,2000s,Alternative/Indie,2009,
936,60,,,"If I came to you tomorrow,
And said ""let's run away""
Would you roll like the wind does,
Baby would you stay",November Blue,Charlie Daniels. Sung by Avett Brothers,https://youtu.be/gV_SyNfnPxI?t=80,2000s,Country,2002,
937,,63,,"Got no feel, I got no rhythm
I just keep losing my beat (you just keep losing and losing)
I'm OK, I'm alright (he's alright, he's alright)
I ain't gonna face no defeat (yeah, yeah)
I just gotta get out of this prison cell
One day (someday) I'm gonna be free, Lord Find me somebody to love.",Somebody to Love,Freddie Mercury Sung by Queen,https://youtu.be/kijpcUv-b8M?t=163,1970s,Jazz/Blues/RnB,1976,
938,,64,,"If it's square, we ain't there.
We make every minute count, our share is always the biggest amount
Other guys imitate us, but the original is still the greatest, in crowd!
Any time of the year, don't you hear?
Spendin' cash, talkin' trash
I'll show you a real good time, come on with me,
leave your troubles behind I don't care where you've been, you ain't been nowhere til you've been in
With the in crowd",In Crowd,"Billy Page and Ramsey Lewis. Sung here by Dobie Gray, played by Ramsey Lewis Trio",https://youtu.be/OOWO--z1S8A?t=92.    https://youtu.be/5vu2tyk8cvc?t=199,1960s,Jazz/Blues/RnB,1964-5,
939,,62,,"So kiss me and smile for me
Tell me that you'll wait for me
Hold me like you'll never let me go
'Cause I'm leavin' on a jet plane
Don't know when I'll be back again
Oh babe, I hate to go",Leaving on a Jet Plane,John Denver Sung here with Mama Cass Elliot,https://youtu.be/bRe648clNjg?si=CKZMVP8-NlglPqtL&t=147,1960s,Folk/Protest,1969,
940,68,,,"All my bags are packed
I'm ready to go
I'm standin' here outside your door
I hate to wake you up to say goodbye
But the dawn is breakin'
It's early morn
The taxi's waitin'
He's blowin' his horn
Already I'm so lonesome
I could die",Leaving on a Jet Plane,John Denver ,https://youtu.be/vLBKOcUbHR0?t=32,1960s,Folk/Protest,1969,
941,,63,,"Today while the blossoms still cling to the vine
I'll taste your strawberries, I'll drink your sweet wine
A million tomorrows shall all pass away
Ere I forget all the joy that is mine today",Today,Randy Sparks  Sung by The New Christy Minstrels,https://youtu.be/r97s3KJ_kHI?t=5,1960s,Folk/Protest,1964,
942,69,,,"Well, I told my mama on the day I was born
Don'tcha cry when you see I'm gone
You know, there ain't no woman gonna settle me down
I just gotta be travelin' on","Green, Green",Barry McGuire and Randy Sparks Sung by The New Christy Minstrels,https://youtu.be/oM3_hD6Mr5g?t=22,1960s,Folk/Protest,1963,
943,65,,,"When the sun comes back, and the first quail calls
Follow the drinkin' gourd
For the old man is waiting just to carry you to freedom",Follow the Drinkin' Gourd,Traditional and Lee Hays Sung here by The Weavers and by Richie Havens,https://youtu.be/b2vsf77OTdc?t=28.  https://youtu.be/gBOP8t2hlFQ?t=38,Vintage,Folk/Protest,1928,
944,,65,,"Oh, but he watches her so sadly
How can he tell her he loves her?
Yes, he would give his heart gladly
But each day, when she walks to the sea
She looks straight ahead, not at he",Girl from Ipanema,"Antônio Carlos Jobim [English by Norman Gimbel] Sung here by Frank Sinatra
& Antônio Carlos Jobim ",https://youtu.be/NldPFVKYmiw?t=50,1960s,Jazz/Blues/RnB,1962,
945,,66,,"Wishin' I'd realized what I had when you were mine, I'd go back to December, turn around and make it alright
I'd go back to December, turn around and change my own mind
I go back to December all the time
All the time",Back to December,Taylor Swift,https://youtu.be/QUwxKWT6m7U?t=254,2010s,Country,2010,
946,,61,,"It's me, hi, I'm the problem, it's me (I'm the problem, it's me)
At tea time, everybody agrees
I'll stare directly at the sun but never in the mirror",Anti-Hero,Taylor Swift,https://youtu.be/b1kbLwvqugk?t=254,2010s,Pop,2022,
947,58,,,"He rules the world with truth and grace
And makes the nations prove
The glories of His righteousness
And wonders of His love
And wonders of His love
And wonders, wonders, of His love",Joy to the World,"Isaac Watts Sung here by Celtic Women (Live At The Helix In Dublin, Ireland/2013)",https://youtu.be/VDmIddF7DfQ?t=83,Vintage,Alternative/Indie,1719,
948,,,75,"Everybody knows a turkey and some mistletoe
Help to make the season bright
Tiny tots with their eyes all aglow
Will find it hard to sleep tonight",The Christmas Song (Chestnuts Roasting by an Open Fire),Robert Wells and Mel Tormé Sung here by Nat King Cole,https://youtu.be/5QJNhCi3AyA?t=35,Vintage,Alternative/Indie,1945,
949,71,,,"Said the night wind to the little lamb
Do you see what I see?
(Do you see what I see?)
Way up in the sky, little lamb
Do you see what I see?
(Do you see what I see?)
A star, a star, dancing in the night
With a tail as big as a kite
With a tail as big as a kite",Do You Hear What I Hear?,Noël Regney & Gloria Shayne Sung here by Bing Crosby,https://youtu.be/XuE_DXrt2Js?t=5,Vintage,Alternative/Indie,1962,
950,70,,,"Baby tell me what you want
Cuz I'm gonna give you all I got, girl
Baby tell me what you want
Baby tell me what you want
My hands shaped like a puzzle you can fit in
I want to be the pieces that you're missing
Oh I can see the picture that we're both in
I could be the one to be the keys to your lock
I'll give you all I got",Supply and Demand,Wilder Woods,https://youtu.be/iGJATLdnvWg?t=75,2010s,Alternative/Indie,2019,
951,,64,,"Tomorrow may rain with sorrow
Here's a little time we can borrow
Forget all our troubles in these moments so few
Oh because right now is only thing
That all that we really have to do
Is have ourselves, a heavenly day",Heavenly Day,Patty Griffin,https://youtu.be/8cdnF3NUSCY?t=75,2000s,Folk/Protest,2007,
952,,66,,"I'm going back South
Down to Carolina
I'm gonna plant myself
Under a magnolia
I'm gonna let that dirt
Do its work
I'm gonna plant myself",Magnolia Blues,Adia Victoria,https://youtu.be/sVlQPpQ3xlY?t=45,2010s,Jazz/Blues/RnB,2021,
953,61,,,"Well i was runnin late for work
so i poured me some coffee to go
and just before i had a flat tire i spilled it all over my clothes
when the highway patrollman pulled up i thought that help was on the way
but when he saw the tire tool in my hand he shot me with pepper spray",It's a Great Day to Whup Somebody's Ass,Paul Thorn,https://youtu.be/iPM1ifkOQ9s?t=69,2000s,Country,2008,
954,62,,,"All I needed was the love you gave
All I needed for another day
And all I ever knew
Only you This is gonna take a long time
And I wonder what's mine
Can't take no more
Wonder if you'll understand
It's just the touch of your hand
Behind a closed door",Only You,Joshua Radin,https://youtu.be/DzOg3M1CMXE?t=73,2000s,Alternative/Indie,2006,
955,,62,,"We'll be feelin' alright
When the sun sinks down over the water
Uncle Kenny's hotter when the sun goes down",When the sun goes down,Kenny Chesney,https://youtu.be/eGLdbpmXrbQ?t=281,2000s,Pop,2004,
956,,67,,"We were Jesus save me, blue jean baby
Born in the USA
Trailer park truck stop, faded little map dots
New York to LA",American Kids,Kenny Chesney,https://youtu.be/de1aPKXBdAE?t=39,2010s,Country,2014,
957,,63,,"Last Friday night
Yeah, we danced on tabletops, and we took too many shots
Think we kissed, but I forgot last Friday night
Yeah, we maxed our credit cards and got kicked out of the bar
So we hit the boulevard last Friday night
We went streaking in the park, skinny-dipping in the dark
Then had a ménage à trois",Last Friday Night,"Katy Perry, Lukasz Gottwald, Max Martin & Bonnie McKee. Sung by Katy Perry ",https://youtu.be/KlyXNRrsk4A?t=84,2010s,Pop,2011,
958,,,intro,"Let's start the new year right
Twelve o'clock tonight
When they dim the light
Let's begin
Kissing the old year out
Kissing the new year in
",Let's Start the New Year Right,Irving Berlin Sung here by Bing Crosby from film Holiday Inn,https://youtu.be/mFmWurPim-0?t=18,Vintage,Musical/Movie,1942,
959,61,,,"Time to make it happеn 'cause it feels so good
Singin' in the mirror like it's Hollywood
Lifе is gettin' shorter, gotta drink it up
Time to shine like I know you should
Slide to the left, then slide to the right
Jump in the air 'til you're ten feet high, yeah
Come on, come on and make it your night",Giddy Up,Shania Twain,https://youtu.be/-6BGu-GyKWQ?t=44,2010s,Country,2023,
960,,,,"Missed the Saturday dance
Heard they crowded the floor
Couldn't bare it without you",Don't’ Get Around Much Anymore,Duke Ellington & Bob Russell,https://youtu.be/yxwvOncHVbQ?t=68,Vintage,Jazz/Blues/RnB,1942,
961,71,,,"Hey! Hey! Hey! Hey!
Cars and girls are easy come by in this day and age
Laughing, joking, drinking, smoking
Till I've spent my wage
When I was young people spoke of immorality
All the things they said were wrong
Are what I want to be",Over Under Sideways Down,Jeff Beck & Jim McCarty.Sung by The Yardbirds,https://youtu.be/L4DdAs0PddQ?t=2,1960s,Rock,1966,
962,,68,,"Sick at heart and lonely
Deep in dark despair
Thinking one thought only
Where is she, tell me where
And if she says to you
She don't want me
Just give her my message
Tell her of my plea
And I know, if she had me back again
Oh, I would never make her sad",Heart Full of Soul,Graham Gouldman Sung by The Yardbirds,https://youtu.be/5kKJ2BRGA5s?t=4,1960s,Rock,1965,
963,72,,,"War, children, it's just a shot away
It's just a shot away
War, children, it's just a shot away
It's just a shot away
Rape, murder!
It's just a shot away",Gimme Shelter ,"Mick Jagger & Keith Richards, Sung by Rolling Stones & Merry Clayton",https://youtu.be/LDxpdFKuGb4?t=63,1960s,Rock,1969,
964,,,74,"I see the girls walk by
Dressed in their summer clothes
I have to turn my head
Until my darkness goes...
I've seen people turn their heads
And quickly look away
Like a newborn baby
It just happens everyday",Paint it Black ,"Mick Jagger & Keith Richards, Sung by Rolling Stones",https://youtu.be/O4irXQhgMqg?t=24,1960s,Rock,1966,
965,109,,,"With no lovin' in our souls
And no money in our coats
You can't say we're satisfied",Angie,"Mick Jagger & Keith Richards, Sung by Rolling Stones",https://youtu.be/RcZn2-bGXqQ?t=49,1970s,Rock,1973,
966,,64,,"When I'm driving in my car
When a man come on the radio
He's telling me more and more
About some useless information
Supposed to fire my imagination",Satisfaction ,"Mick Jagger & Keith Richards, Sung by Rolling Stones",https://youtu.be/nrIPxlFzDi0?t=40,1960s,Pop,1965,
967,,68,,"I saw her today at the reception
A glass of wine in her hand
I knew she would meet her connection
At her feet was her footloose man",You Can’t Always Get What You Want ,"Mick Jagger & Keith Richards, Sung by Rolling Stones",https://youtu.be/jv9sDn_2XkI?t=1,1960s,Jazz/Blues/RnB,1969,
968,61,,,"She would never say where she came from
Yesterday don't matter if it's gone
While the sun is bright
Or in the darkest night
No one knows, she comes and goes",Ruby Tuesday,"Keith Richards, Sung by Rolling Stones",https://youtu.be/fvp6gseKJS8?t=5,1970s,Rock,1967,
969,,,63,"Am I hard enough?
Am I rough enough?
Am I rich enough?
I'm not too blind to see",Beast of Burden ,Keith Ridhards by Rolling Stones,https://youtu.be/-tRdBsnX4N4?t=51,1970s,Rock,1978,
970,,,78,"Well, I spent some time in the Mudville Nine
Watching it from the bench
You know I took some lumps
When the Mighty Casey struck out
So say, ""Hey Willie, tell Ty Cobb and Joe DiMaggio""
Don't say it ain't so you know the time is now",Centerfield,John Fogerty,https://youtu.be/Xq3hEMUeBGQ?t=80,1980s,Rock,1985,
971,50,,,"Jessie is a friend
Yeah, I know, he's been a good friend of mine
But lately something's changed that ain't hard to define
Jessie's got himself a girl and I want to make her mine",Jessie's Girl,Rick Springfield,"<iframe width=""445"" height=""250"" src=""https://www.youtube.com/embed/qYkbTyHXwbs?start=5"" title=""YouTube video player"" frameborder=""0"" allow=""accelerometer; autoplay; clipboard-write; encrypted-media; gyroscope; picture-in-picture; web-share"" allowfullscreen></iframe>",1980s,Rock,1981,
972,,70,,"Lady, running down to the riptide
Taken away to the dark side
I wanna be your left-hand man
I love you when you're singing that song
And I got a lump in my throat
'Cause you're gonna sing the words wrong",Riptide,Vance Joy ,https://youtu.be/uJ_1HMAGb4k?t=38,2010s,Rock,2013,
973,4,65,33,"I've been spending way too long checking my tongue in the mirror
And bending over backwards just to try to see it clearer
But my breath fogged up the glass
And so I drew a new face and I laughed
I guess what I be saying is there ain't no better reason
To rid yourself of vanities and just go with the seasons
It's what we aim to do
Our name is our virtue",I'm Yours,Jason Mraz,https://youtu.be/EkHTsc9PU2A?t=123,2000s,Pop,2008,
974,,65,,"Guinevere had green eyes
Like yours, milady, like yours
She'd walk down through the garden
In the morning after it rained
Peacocks wandered aimlessly
Underneath an orange tree
Why can't she see me?
As she turns her gaze
Down the slope to the harbor where I lay
Anchored for the day",Guinnevere,David Crosby,https://youtu.be/eEjqSQvMfM4?t=36,1960s,Folk/Protest,1969,
975,,,76,"Voices of the angels
Ring around the moonlight
Asking me, said she's so free
How can you catch the sparrow?
Lacy lilting lady
Losing love lamenting
Change my life, make it right
Be my lady",Suite: Judy Blue Eyes,"Stephen Stills  Sung by Crosby, Stills & Nash ",https://youtu.be/kVUwrifwKrI?t=390,1960s,Rock,1969,
976,,67,,"Don't you ever ask them, ""Why?""
If they told you, you would cry
So just look at them and sigh
And know they love you",Teach Your Children,"Graham Nash by Crosby, Stills & Nash",https://youtu.be/dQOaUnSmJr8?t=61,1960s,Folk/Protest,1969,
977,,71,,"Sweeping cobwebs from the edges of my mind
Had to get away to see what we could find
Hope the days that lie ahead
Bring us back to where they've led
Listen not to what's been said to you",Marrakesh Express,"Graham Nash by Crosby, Stills & Nash",https://youtu.be/sF4Gc8hjPdA?t=21,1960s,Rock,1969,
978,,66,,"I'll light the fire
You place the flowers in the vase
That you bought today
Staring at the fire
For hours and hours while I listen to you
Play your love songs all night long
For me, only for me",Our House,"Graham Nash by Crosby, Stills, Nash & Young",https://youtu.be/aunVlekXjkE?t=1,1970s,Pop,1970,
979,111,,,"If you're down and confused
And you don't remember who you're talkin' to
Concentration slip away
Because your baby is so far away
Well, there's a rose in a fisted glove
And the eagle flies with the dove",Love the One You’re With,Stephen Stills,https://youtu.be/Ct_kY0ln6Ec?t=9,1970s,Folk/Protest,1970,
980,,,64,"We can change the world
Re-arrange the world
It's dying ... if you believe in justice
It's dying ... and if you believe in freedom
It's dying ... let a man live his own life
It's dying ... rules and regulations, who needs them
Throw 'em out the door

Somehow people must be free
I hope the day comes soon
Won't you please come to Chicago
Show your face",Chicago/We Can Change the World,Graham Nash,https://youtu.be/WBnHS4W6anE?t=138,1970s,Folk/Protest,1971,
981,,,,"I feel like letting my freak flag fly
Yes I feel like, I owe it to someone
Must be because I had the flu' for Christmas
And I'm not feelin' up to par, it increases my paranoia
Like lookin' at my mirror and seein' a police car
But I'm not givin' in an inch to fear",Almost Cut My Hair,"David Crosby Sung by Crosby, Stills, Nash & Young",https://youtu.be/p1M3-m9VDqc?t=80,1970s,Rock,1970,
982,,103,,"Four and 20 years ago
I come into this life
The son of a woman and a man
Who lived in strife
He was tired of being poor
And he wasn't into selling door to door
And he worked like the devil to be more",4+20,"Stephen Stills Sung by Crosby, Stills, Nash & Young",https://youtu.be/oSdy4uNwR54?t=4,1970s,Rock,1970,
983,127,,,"The fortunes of fables are able
To sing the song
Now witness the quickness with which
We get along
To sing the blues you've got to live the dues",Carry On,"Stephen Stills Sung by Crosby, Stills, Nash & Young",https://youtu.be/2NJqyQ0b5tw?t=179,1970s,Folk/Protest,1970,
984,74,,,"Turn, turn any corner
Hear, you must hear what the people say
You know there's something that's going on around here
It surely, surely, surely won't stand the light of day, no
And it appears to be a long (Yes, it does)
Appears to be a long (Mmm)
Appears to be a long
Time, such a long, long time
Before the dawn",Long Time Gone,"David Crosby Sung by Crosby, Stills, Nash & Young",https://youtu.be/ufuMffkf8VU?t=70,1960s,Folk/Protest,1969,
985,,67,,"All that summer, we enjoyed it
Wind and rain and shine
And that umbrella, we employed it
By August, she was mine
Every mornin', I would see her waiting at the stop
Sometimes she'd shopped and she would show me what she bought
All the people stared as if we were both quite insane
Someday my name and hers are going to be the same",Bus Stop,"Graham Gouldman,  Sung by The Hollies",https://youtu.be/It75wQ0JypA?t=19,1960s,Pop,1966,
986,75,,,"Movin' on their way
Walkin' down the highways and the by ways
(Where do they go)
Movin' on their way
People with their shy ways and their sly ways
Oh, you can see the little children
All around
Oh, you can see the little ladies
In their gowns ",Look Through Any Window,"Graham Gouldman & Charles Silverman, Sung by The Hollies",https://youtu.be/CQp1IDVZdCg?t=21,1960s,Pop,1965,
987,,69,,"Like painted kites
Those days and nights, they went flyin' by
The world was new
Beneath a bright blue umbrella sky
Then softer than a piper man
One day, it called to you
And I lost you, I lost you
To the summer wind",Summer Wind,Johhny Mercer & Hans Bradtke Sung here by Frank Sinatra,https://youtu.be/uSJLVPqbz6Q?t=62,1960s,Pop,1965,
988,,68,,"I resolved to call her up
A thousand times a day
And ask her if she'll marry me
Some old-fashioned way
But my silent fears have gripped me
Long before I reach the phone
Long before my tongue has tripped me
Must I always be alone",Every Little Thing She Does Is Magic,Sting Sung byThe Police,https://youtu.be/sxkMFgFjC8E?t=92,1980s,Pop,1981,
989,,72,,"A year has passed since I wrote my note
I should have known this right from the start
Only hope can keep me together
Love can mend your life
Or love can break your heart
I'll send an S.O.S to the world
I'll send an S.O.S to the world",Message in A Bottle,Sting Sung byThe Police,https://youtu.be/MbXWrmQW-OE?t=60,1970s,Rock,1979,
990,59,,,"I have climbed highest mountains
I have run through the fields
Only to be with you
Only to be with you
I have run
I have crawled
I have scaled these city walls
These city walls
Only to be with you",I Still Haven’t Found What I’m Looking For,Bono sung by U2,https://youtu.be/e3-5YC_oHjE?t=25,1980s,Jazz/Blues/RnB,1987,
991,,69,,"Church bells are ringin'
Choirs are singing
While the preachers groan
And the sisters moan
In a blessed tone
Down in the Treme
Just me and my baby
We're all going crazy
Buck jumping and having fun",Treme,John Boutté,https://youtu.be/FCNFmYoenmQ?t=62,2000s,Jazz/Blues/RnB,2003,
992,63,,,"Where has that old friend gone
Lost in a February song
Tell him it won't be long
'Til he opens his eyes, opens his eyes
Where is that simple day
Before colors broke into shades
And how did I ever fade
Into this life, into this life",February Song,"Josh Groban, Five For Fighting, Sung by Groban",https://youtu.be/KksJe5dyFtI?t=27,2000s,Pop,2006,
993,76,,,"I've been a puppet, a pauper, a pirate, a poet
A pawn and a king
I've been up and down and over and out
And I know one thing
Each time I find myself layin'
Flat on my face
I just pick myself up and get
Back in the race",That's Life,Dean Kay and Kelly Gordon  Sung by Frank Sinatra,,1960s,Pop,1966,
994,,70,,"Where it began, I can't begin to knowing
But then I know it's growing strong
Was in the spring
And spring became the summer
Who'd have believed you'd come along
Hands, touching hands
Reaching out, touching me, touching you",Sweet Caroline ,Neil Diamond,https://youtu.be/1vhFnTjia_I?t=14,1960s,Pop,1969,
995,,,79,"Now he's gone, now he's gone, Lord he's gone, he's gone
Like a steam locomotive, rollin' down the track
He's gone, he's gone and nothin's gonna bring him back, he's gone
Nine mile skid on a ten mile ride, hot as a pistol but cool inside
Cat on a tin roof, dogs in a pile
Nothin' left to do but smile, smile, smile",He's Gone,"Robert Hunter, Jerry Garcia, Bob Weir, Phil Lesh. Sung by Grateful Dead",https://youtu.be/dRwq9HrkTI0?t=106,1970s,Rock,1972,
996,60,,,"It must be getting early
Clocks are running late
Paint by numbers morning sky
Looks so phony
Dawn is breaking everywhere
Light a candle, curse the glare
Draw the curtains, I don't care
'Cause it's alright
I will get by
I will get by
I will get by
I will survive",Touch of Grey,"Jerry Garcia, Robert Hunter, Sung by Grateful Dead",https://youtu.be/mzvk0fWtCs0?t=30,1980s,Rock,1987,
997,,68,,"Stoking the star maker machinery
Behind the popular song
I deal in dreamers
And telephone screamers
Lately I wonder what I do it for
If l had my way
I'd just walk out those doors
And wander
Down the Champs Elysees
Going cafe to cabaret
Thinking how I'll feel when I find
That very good friend of mine",Free Man in Paris,Joni Mitchell,https://youtu.be/2hcXdtqojFg?t=100,1970s,Folk/Protest,1974,
998,,69,,"Don't be stuck up in Alaska
When you should be in Nebraska
On a Thursday when it's Egg & Daughter Nite
When the farmers come to town
And they spread them eggs around
And they drop their daughters down at the roller rink
Well you're prob'ly standin' there
With your slicked-back, Brylcreem hair
Your Lucky's and your daddy's fine-tooth comb
If they knew what you were thinkin'
They'd run you out of Lincoln
Just blame it on that ole' crazy bone","Egg & Daughter Nite, Lincoln Nebraska, 1967 (Crazy Bone)",John Prine,https://youtu.be/z3eMuBJL6C8?t=69,2010s,Folk/Protest,2018,
999,,70,,"Old woman, old woman, don't treat me so mean
You're the meanest old woman that I've ever seen
I guess if you said so
I'll have to pack my things and go (that's right)",Hit The Road Jack,Percy Mayfield. Sung by Ray Charles,https://youtu.be/uSiHqxgE2d0?t=26,1960s,Jazz/Blues/RnB,1961,
1000,,71,,"When I was a little girl, I had a rag doll
It was the only doll that I've ever owned
Now I love you just the way I loved that rag doll
But only now my love has grown","River Deep, Mountain High","Jeff Barry, Ellie Greenwich, Phil Spector. Sung by Ike & Tina Turner",https://youtu.be/uj0wPrN_Y_4?t=4,1960s,Jazz/Blues/RnB,1966,
1001,77,,,"Birds flying high
You know how I feel
Sun in the sky
You know how I feel
Breeze driftin' on by
You know how I feel
It's a new dawn
It's a new day
It's a new life
For me
And I'm feeling good
I'm feeling good",Feeling Good,Anthony Newley and Leslie Bricusse for Roar of the Greasepaint – Smell of the Crowd.  Sung by Nina Simone,https://youtu.be/oHRNrgDIJfo?t=1,1960s,Jazz/Blues/RnB,1964,
1002,,72,,"Where you gonna run to?
All on that day
We got to run to the rock
Please hide me, I run to the rock
Please hide me, run to the rock
Please hide here
All on that day
But the rock cried out
I can't hide you, the rock cried out
I can't hide you, the rock cried out
I ain't gonna hide you there
All on that day",Sinner Man ,DOUBLE FEATURE Sung here by Nina Simone Danced by Alvin Ailey,https://youtu.be/sLB4xxz1GY0?t=17.  https://youtu.be/yjIlP2vX0cc?t=31,Vintage,Jazz/Blues/RnB,1956,
1003,,59,,"If I stand starry eyed,
That's a danger in Paradise
For mortals who stand beside
An angel like you
I saw your face,
And I ascended
Out of the common place
Into the rarest somewhere in space
I hang suspended
Until I know
There's a chance that you care
Won't you answer this fervent prayer?",Stranger in Paradise,Robert Wright and George Forrest from the musical Kismet   Sung by Tony Bennett w/ Andrea Bocelli ,https://youtu.be/WFrUsa5SUv0?t=37,Vintage,Musical/Movie,1953,
1004,,71,,"The morning fog may chill the air, I don't care
My love waits there in San Francisco
Above the blue and windy sea
When I come home to you, San Francisco
Your golden sun will shine for me",I Left My Heart in San Francisco,"Douglass Cross, George Cory   Sung by Tony Bennett",https://youtu.be/hT5VOnaGRSU?t=88,1960s,Pop,1962,
1005,66,,,"It makes no difference if it's sweet or hot
Just give that rhythm everything you got",It Don't Mean a Thing (If It Ain't Got That Swing),"DOUBLE FEATURE-Duke Ellington & Irving Mills. Sung by Ella Fitzgerald & Duke Ellington on The Ed Sullivan Show on March 7, 1965 and by Tony Bennett & Lady Gaga",https://youtu.be/myRc-3oF1d0?t=17. https://youtu.be/LYfF9VKMp4w?t=98,Vintage,Jazz/Blues/RnB,1932,
1006,67,,,"When I was just a little girl
I asked my mother, what will I be
Will I be pretty? Will I be rich?
Here's what she said to me","Whatever Will Be Will Be (Que sera, sera)",Jay Livingston and Ray Evans   Sung by Doris Day,https://youtu.be/xZbKHDPPrrc?t=6,Vintage,Pop,1956,
1007,62,,,"He sat down and took a deeper breath
Then looked right in my face
I heard about the son you lost
How you left without a trace
I've spent years just trying to find you
So I could finally let you know
It was your son's heart that saved me
And a life you gave us both",Just Like That,Bonnie Raitt,https://youtu.be/Skd0XR3twCA?t=136,2010s,Jazz/Blues/RnB,2022,
