,Uploaded (decade),Uploaded (genre),Songs Potpourri,Lyrix,Song name,Artist,Youtube Link,Decade,Genre,Year,Contributed by
455,,16,,"My mother was a tailor, she sewed my new blue jeans. My father was a gamblin’ man Way down in New Orleans. Now the only thing a gambler needs Is a suitcase and a trunk And the only time you keep him satisfied is when he’s all a drunk. Oh mother, tell your children not to do what I have done, Spend your life in sin and misery...I got one foot on the platform, the other on a train. I’m going back to New Orleans to wear that ball and chain.",The House of the Rising Sun,Unknown origin (as popularized by The Animals),https://youtu.be/uS90B4sZf7U?t=45,1960s,Rock,1964,
456,,31,,"Broke, busted, disgusted, agents can't be trusted
And Mitchy wants to go to the sea
Cass can't make it, she says we'll have to fake it
We knew she'd come eventually
Greasin' on American Express cards
It's low rent, but keeping out the heat's hard
Duffy's good vibrations and our imaginations
Can't go on indefinitely",Creeque Alley,John Phillips  Sung byThe Mamas and Pappas,https://youtu.be/USibFMyk3Rw?t=140,1960s,Pop,1967,
457,,26,,"When Amsterdam is golden in the summer,
Margaret brings him breakfast,
She believes him.
He thinks the tulips bloom beneath the snow.
He's mad as he can be, but Margaret only sees that sometimes,
Sometimes she sees her unborn children in his eyes.",The Dutchman,Michael Smith,https://youtu.be/GaKjfTqYfB8?t=42,1960s,Folk/Protest,1968,
458,,,51,"What words of wisdom can I give them?
How can I help to ease their way?
Now they must learn from one another
Day by day
They look so natural together
Just like two newlyweds should be",Sunrise Sunset,Sheldon Harnick and Jerry Bock from Fiddler on the Roof,https://youtu.be/03rzUoyq9K0?t=246,1960s,Musical/Movie,1964,
459,,36,,"How do you think he does it? I don't know
What makes him so good?
Ain't got no distractions
Can't hear no buzzers and bells
Don't see no lights a-flashin'
Plays by sense of smell
Always gets a replay
Never seen him fall",Pinball Wizard from Tommy,Pete Townshend Sung by The Who,https://youtu.be/4AKbUm8GrbM?t=87,1960s,Musical/Movie,1969,
460,,31,,"Cleaned a lot of plates in Memphis
Ya know I pumped a lot of 'tane down in New Orleans
But I never saw the good side of the city
Until I hitched a ride on the riverboat queen",Proud Mary,John Fogerty Sung by Tina Turner,https://youtu.be/02QUmKVsyFY?t=208,1960s,Jazz/Blues/RnB,1968-69,
461,,33,,"Dragonfly out in the sun you know what I mean, don't you know?
Butterflies all havin' fun, you know what I mean
Sleep in peace when day is done, that's what I mean
And this old world, is a new world
And a bold world for me, yeah-yeah",Feeling' Good from The Roar of the Greasepaint – The Smell of the Crowd,Anthony Newley and Leslie Bricusse  Sung by Michael Bublé ,https://youtu.be/Edwsf-8F3sI?t=99,1960s,Jazz/Blues/RnB,1964,
462,,31,,"Dear old Daddy, rest his soul
Left my mom a heavy load
She tried so very hard to fill his shoes
Working hours without rest
Wanted me to have the best
She tried to raise me right, but I refused",Mama Tried,Merle Haggard,https://youtu.be/UKuc4nfJByc?t=80,1960s,Country,1968,
463,,32,,"You've got reasons a-plenty for goin'
This I know, this I know
For the weeds have been steadily growin'
Please don't go, please don't go
Are you goin' away with no word of farewell?
Will there be not a trace left behind?
Well, I could have loved you better, didn't mean to be unkind",The Last Thing on My Mind,Tom Paxton,https://youtu.be/voqL5ksOuoo?t=83,1960s,Country,1964,
464,,29,,"It went ""zip"" when it moved and ""bop"" when it stopped,
And ""whirr"" when it stood still.
I never knew just what it was and I guess I never will",Marvelous Toy,Tom Paxton,https://youtu.be/ahWcocGtEyA?t=97,1960s,Folk/Protest,1968,
465,,3,,"If there's a man
Who is down and needs a helpin' hand
All it takes is you to understand and
To pull him through, ah hah
Seems to me
We got to solve it individually, ah ah
And I'll do unto you what you do to me
Said, no",People Got To Be Free,"Eddie Brigati, Jr. and Felix Caviliere   Sung by The Young Rascals",https://youtu.be/gM1fbZBfcgA?t=81,1960s,Rock,1969,
466,,15,,"I-I love the colorful clothes she wears
And the way the sunlight plays upon her hair
I hear the sound of a gentle word
On the wind that lifts her perfume through the air",Good Vibrations,"Brian Wilson, Mike Love, Tony Asher
​The Beach Boys",https://youtu.be/Eab_beh07HU,1960s,Rock,1963,
467,,6,,"Well, he musta thought that it was quite a joke,
An' it got a lot of laughs from lots a folks,
Seems I had to fight my whole life through.
Some gal would giggle and I'd get red,
And some guy'd laugh and I'd bust his head",Boy Named Sue,Shel Silverstein,https://youtu.be/KZNZt5qVgvM?t=30,1960s,Folk/Protest,1969,
468,,9,,"If I get there before the snow flies and things are goin' good
You could meet me if I sent you down the fare
But by then it would be winter, not too much for you to do
And the winds sure do blow cold way out there",Four Strong Winds,Ian Tyson Sung by Ian and Sylvia,https://youtu.be/B3m7ckGhnsc?t=141,1960s,Folk/Protest,1964,
469,,20,,"If you want to end war and stuff you got to sing loud. I've been singing this song now for twenty five minutes. I could sing it
For another twenty five minutes. I'm not proud... or tired. So we'll wait till it comes around again, and this time with four part
Harmony and feeling. We're just waitin' for it to come around is what we're doing. All right now.",Alice's Restaurant Massacree,Arlo Guthrie,https://youtu.be/m57gzA2JCcM?t=1006,1960s,Folk/Protest,1967,
470,,30,,"Save my love for loneliness,
Save my love for sorrow,
I'm givin' you my only-ness,
Come give your tomorrow.",If I Were a Carpenter ,Tim Hardin,https://youtu.be/F4OiAlgC310?t=52,1960s,Folk/Protest,1967,
471,,29,,"Thrown like a star in my vast sleep
I opened my eyes to take a peek
To find that I was by the sea
Gazing with tranquility",Hurdy Gurdy Man,Donovan,https://youtu.be/jRsrDLkACTs?t=13,1960s,Rock,1968,Sharon & Clay Purdy
472,,,,"Come on, people! Come on, children!
There's a king at the glory river
And the precious king, he loved the people to sing
Babes in the blinkin' sun sang, ""We shall overcome""",Save the Country,Laura Nyro,https://youtu.be/tUiVPCfJqAo?t=311,1960s,Folk/Protest,1969,
473,,,,"I was born from love, and my poor mother worked the mines
I was raised on the Good Book of Jesus
'Til I read between the lines
Now I don't believe I want to see the morning",Stoney End,Laura Nyro  Sung also by Barbra Streisand,https://youtu.be/6diadP-g_7s?t=9.    https://youtu.be/pkzVcOJ7cwc?t=11,1960s,Pop,1967,
474,,28,43,"The girls in New York City, they all march for women's lib
And better homes and garden shows the modern way to live
And the pill may change the world tomorrow, but meanwhile, today
Here in Topeka, the flies are a buzzin'
The dog is a barkin' and the floor needs a scrubbin'
One needs a spankin' and one needs a huggin'",One's On The Way,Loretta Lynn,https://youtu.be/HAEzfdBMN5k?t=116,1970s,Country,1972,
475,,23,,"In the park I saw a daddy
With a laughin' little girl who he was swingin'
And I stopped beside a Sunday school
Listened to the song they were singin'
Then I headed back for home
And somewhere far away a lonesome bell was ringin'
And it echoed through the canyons
Like the disappearing dreams of yesterday",Sunday Morning Coming Down,Kris Kristofferson,https://youtu.be/vbqGWTxwZEA?t=151,1970s,Country,1970,
476,,1,,"I am an old woman named after my mother, my old man is another child that's grown old. If dreams were lightning, thunder was desire, this old house would have burnt down a long time ago.--------
There's flies in the kitchen, I can hear 'em they're buzzin',
And I ain't done nothin' since I woke up today.
How the hell can a person go to work in the mornin',
And come home in the evenin' And have nothin' to say.",Angel from Montgomery,John Prine (sung with Bonnie Raitt),https://youtu.be/KOW-Eoms07c?t=35,1970s,Country,1971,
477,,24,,"And I've been from Tucson to Tucumcari
Tehachapi to Tonopah
Driven every kind of rig that's ever been made
Driven the backroads so I wouldn't get weighed
And if you give me weed, whites and wine
And you show me a sign",Willin',Lowell George Sung by Little Feat,https://youtu.be/Glacxavm0fY?t=47,1970s,Country,1971,
478,,8,,"My Daddy taught me young how to hunt and how to whittle, he taught me how to work and play a tune on the fiddle. He taught me how to love and how to give just a little... Well, I got me a fine wife, I got me old fiddle, When the sun's coming up, I got cakes on the griddle. And life ain't nothing but a funny, funny riddle.",Thank God I'm a Country Boy,John Denver,https://youtu.be/aRgL92K5zuE?t=145,1970s,Country,1974,
479,,4,,All you gotta do is smile that smile and there go all my defenses. Just leave it up to you and in a little while you're messin' up my mind and fillin' up my senses,Here You Come Again,Dolly Parton,https://youtu.be/bflkeWVTNk0?t=47,1970s,Country,1977,
480,,11,11,"He said, ""Son, I've made a life out of readin' people's faces, Knowin' what the cards were By the way they held their eyes. So if you don't mind me sayin', I can see you're out of aces. For a taste of your whiskey, I'll give you some advice.”",The Gambler,Kenny Rogers,https://www.youtube.com/watch?v=7hx4gdlfamo#t=0m26s,1970s,Country,1978,
481,,25,,"When he came across this young man sawin' on a fiddle and playin' it hot
And the devil jumped up on a hickory stump
And said, ""boy, let me tell you what""
""I guess you didn't know it but I'm a fiddle player too
And if you'd care to take a dare, I'll make a bet with you
Now you play a pretty good fiddle, boy
But give the devil his due
I'll bet a fiddle of gold against your soul
'Cause I think I'm better than you""
The boy said, ""my name's Johnny and it might be a sin
But I'll take your bet, you're gonna regret
'Cause I'm the best there's ever been""",The Devil Went Down to Georgia,Charlie Daniels,https://youtu.be/A7p817ErVsQ?t=27,1970s,Country,1979,
482,,23,,"Hey farmer, farmer put away that DDT now
Give me spots on my apples, but leave me the birds and the bees, Please
Don't it always seem to go
That you don't know what you've got till it's gone
They paved paradise, put up a parking lot
(Ooh, bop-bop-bop-bop, ooh, bop-bop-bop-bop)",Big Yellow Taxi,Joni Mitchell,https://youtu.be/94bdMSCdw20?t=60,1970s,Folk/Protest,1970,
483,,Simon,,"I’d rather be a hammer than a nail. Yes, I would, if I only could. I surely would. I’d rather be a forest than a street, yes, I would, if I could. I surely would. I’d rather sail away like a swan that’s here and gone. A man gets tied up to the ground. He gives the world its saddest sound, its saddest sound.",El Condor Pasa,Paul Simon,https://www.youtube.com/watch?v=QqJvqMeaDtU#t=1m36s,1970s,Folk/Protest,1970,
484,,4,7,"Dealin' card games with the old men in the club car,
​penny a point ain't no one keepin' score. Pass the paper bag that
holds the bottle, Feel the wheels rumblin' 'neath the floor.",City of New Orleans,Steve Goodman,https://youtu.be/2SfPyg-mGhU?t=56,1970s,Folk/Protest,1971,
485,,13,,"People smile and tell me I'm the lucky one, And we've only just begun. Think I'm gonna have a son. He will be like she and me, as free as a dove, Conceived in love. Sun is gonna shine above.",Danny's Song,Loggins & Messina (Kenny Loggins),https://www.youtube.com/watch?v=4FDcTyyXQb8#t=0m04s,1970s,Folk/Protest,1971,
486,,18,,"When I woke up this morning, things were lookin' bad, Seem like total silence was the only friend I had. Bowl of oatmeal tried to stare me down... and won And it was twelve o'clock before I realized
That I was havin' ... no fun.",Illegal Smile,John Prine,https://www.youtube.com/watch?v=MmjnQjRvPUQ#t=0m06s,1970s,Folk/Protest,1971,
487,,54,,"And it's Friday night and you're looking clean
Too early to start the rounds
A ten minute ride from the Gold Coast back make sure you're pleasure bound
And it's four o'clock in the morning and all of the people have gone away
Just you and your mind",Lake Shore Drive,Aliotta Haynes & Jeremiah (Skip Haynes),https://www.youtube.com/watch?v=0saZiLV7-7E#t=1m36s,1970s,Folk/Protest,1971,
488,,,52,"All my memories gather round her, miner's lady, stranger to blue water. Dark and dusty, painted on the sky, misty taste of moonshine, teardrops in my eye...I hear her voice in the morning hour, she calls me, radio reminds me of my home far away, And driving down the road, I get a feeling that I should have been home yesterday, yesterday.","Take Me Home,  Country Roads","Bill Danoff, Taffy Nivert and John Denver Sung by John Denver",https://youtu.be/1vrEljMfXYo?t=53,1970s,Country,1971,
489,,,15,"​I don't know no love songs and I can't sing the blues anymore, but I can sing this song, and you can sing this song when I'm gone.
Well it won't be long before another day. We're gonna have a good time, And no one's gonna take that time away, You can stay as long as you like.",You Can Close Your Eyes,James Taylor,https://youtu.be/B2hTQjK1Fa4?t=47,1970s,Folk/Protest,1971,
490,,,,"Good Hearted Woman
And that old north wind begins to blow
Keep your head together And call my name out loud
Soon you'll hear me knockin' at your door",You've Got a Friend,Carole King,https://youtu.be/eAR_Ff5A8Rk?t=108,1970s,Folk/Protest,1971,
491,,Simon,,"Holes in my confidence. Holes in the knees of my jeans. I was left without a penny in my pocket. Oo-we, I was about as destituted as a kid could be and I wished I wore a ring so I could hock, I’d like to hock it.",Duncan,Paul Simon,https://www.youtube.com/watch?v=u3_UddjEGMA#t=1m30s,1970s,Folk/Protest,1972,
492,,,,"He was born in the summer of his 27th year, coming home to a place he'd never been before. He left yesterday behind him, you might say he was born again. You might say he found a key for every door. When he first came to the mountains, his life was far away on the road and hanging by a song. But the strings already broken and he doesn't really care. It keeps changing fast, and it don't last for long.",Rocky Mountain High,John Denver,https://youtu.be/LLWD2WIvRQk?t=12,1970s,Folk/Protest,1972,
493,,14,,"My feet are too long, My hair's falling out and my rights are all wrong, My friends they all tell me that I've no friends at all, Won't you write me a letter, Won't you give me a call, Signed Bewildered",Dear Abby,John Prine,https://www.youtube.com/watch?v=LJVFY_LX9Ik#t=0m09s,1970s,Folk/Protest,1973,
494,,x,,"I've long since retired, my son's moved away. I called him up just the other day. “""I'd like to see you, if you don't mind."" He said, ""I'd love to, Dad, if I could find the time. You see my new job's a hassle and the kids have the flu,
But it's sure nice talkin' to you, Dad. It's been sure nice talkin' to you.""",Cats in the Cradle,Harry Chapin,https://www.youtube.com/watch?v=KUwjNBjqR-c#t=2m37s,1970s,Folk/Protest,1974,
495,,8,8,"Does any one know where the love of God goes
When the waves turn the minutes to hours?
The searchers all say they'd have made Whitefish Bay
If they'd put fifteen more miles behind her
They might have split up or they might have capsized
They may have broke deep and took water
And all that remains is the faces and the names
Of the wives and the sons and the daughters",The Wreck of the Edmund Fitzgerald,Gordon Lightfoot,https://youtu.be/9vST6hVRj2A?t=213,1970s,Folk/Protest,1976,
496,,10,,"One night I dreamed I was in slavery 'Bout 1850 was the time. Sorrow was the only sign, Nothing around to ease my mind.  Out of the night appeared a lady Leading a distant Pilgrim band. ""First mate"" she yelled, pointing her hand. ""Make room aboard for this young woman. Singing come on up, I got a lifeline, Come on up to this train of mine, Come on up, I got a lifeline, Come on up to this train of mine.",,Walter Robinson (sung by Holly Near and Ronnie Gilbert),https://youtu.be/-6MpN2GfBCQ?t=26,1970s,Folk/Protest,1977,
497,,8,,"Does anyone know where the love of God goes.
When the waves turn the minutes to hours?
The searches all say they'd have made Whitefish Bay.
If they'd put fifteen more miles behind her.
They might have split up or they might have capsized. They may have broke deep and took water
And all that remains is the faces and the name.
​Of the wives and the sons and the daughter.",The Wreck of the Edmund Fitzgerald,Gordon Lightfoot,https://youtu.be/PH0K6ojmGZA?t=198,1970s,Folk/Protest,1976,
498,,24,,"It's getting near dawn
When lights close their tired eyes
I'll soon be with you my love
Give you my dawn surprise
I'll be with you darling soon
I'll be with you when the stars start falling
I've been waiting so long
To be where I'm going",Sunshine of my Love,"Eric Clapton, Pete Brown and Jack Bruce  Cream",https://youtu.be/zt51rITH3EA?t=18,1970s,Jazz/Blues/RnB,1972,
499,,29,,"Why should you want to know? Don't you mind about the future? Don't you try to think ahead? Save tomorrow for tomorrow; Think about today instead. I could give you facts and figures. Even give you plans and forecasts. Even tell you where I'm going. Why should you want to know? Why are you obsessed with fighting Times and fates you can't defy? If you knew the path we're riding, You'd understand it less than I.",What's The Buzz / Strange Thing Mystifying / Jesus Christ Superstar,Andrew Lloyd Webber and Tim Rice (sung by John Legend as Jesus),https://www.youtube.com/watch?v=zbGEuNi2SKs#t=0m13s,1970s,Musical/Movie,1970,
500,,23,,"She swam by me she got a cramp, He ran by me got my suit damp, I saved her life she nearly drowned, He showed off splashing around
Summer sun somethings begun but oh oh the summer nights, Tell me more, tell me more, Was it love at first sight? Tell me more, tell me more Did she put up a fight?",Summer Nights / Grease,Jim Jacobs and Warren Casey (sung by John Travolta as Danny Zuko and Olivia Newton-John as Sandy),https://youtu.be/ZW0DfsCzfq4?t=69,1970s,Musical/Movie,1971,
501,,26,,"Scattered pictures, Of the smiles we left behind, Smiles we gave to one another...Can it be that it was all so simple then? Or has time re-written every line? If we had the chance to do it all again Tell me, would we? Could we?",Barbra Streisand /The Way We Were,Alan and Marilyn Bergman / Barbra Streisand,https://youtu.be/T9-jWsb3nmA?t=58,1970s,Musical/Movie,1974,
502,89,,,"I got chills, They're multiplying And I'm losing control Cause the power you're supplying, It's electrifying! You better shape up Cause I need a man And my heart is set on you.",You're the One That I Want / Grease,John Farrar (sung by John Travolta as Danny Zuko and Olivia Newton-John as Sandy) ,https://youtu.be/7oKPYe53h78?si=4as0jLaq_eNpZ8gQ&t=54,1970s,Musical/Movie,1978,
503,,8,,"It won't be easy, you'll think it strange
When I try to explain how I feel
That I still need your love after all that I've done
You won't believe me, all you will see is a girl you once knew
Although she's dressed up to the nines
At sixes and sevens with you
I had to let it happen, I had to change
Couldn't stay all my life down at heel
Looking out of the window, staying out of the sun
So I chose freedom, running around trying everything new
But nothing impressed me at all
I never expected it to","Don't Cry for Me, Argentina / Evita","Tim Rice, Andrew Lloyd Webber, Petula Clark,  as sung by Madonna",https://youtu.be/KD_1Z8iUDho?t=51,1970s,Musical/Movie,1979,
504,,,,"Don't it feel like the wind is always howl'n?  Don't it seem like there's never any light! Once a day, don't you wanna throw the towel in?  It's easier than puttin' up a fight No one's there when your dreams at night get creepy, No one cares if you grow or if you shrink, Empty belly life, Rotten smelly life, Full of sorrow life, No tomorrow life, Santa Claus we never see , Santa Claus, what's that? , Who's he?, No one cares for you a smidge When you're in an orphanage.",It's a Hard Knock Life for Us,Martin Charnin (sung by the orphan kids),https://youtu.be/-0bOH8ABpco?t=68,1970s,Musical/Movie,1977,
505,,29,,"I walk down the mall, Stand over by the wall
Where I can see it all, Find out who ya call!
Lead you to the supermarket checkouts
Some specials and rat food, Get lost in the crowd",One Way Or Another,Debbie Harry (Blondie) and Nigel Harrison,https://youtu.be/_zBwRDEFMRY?t=162,1970s,Pop,1978,
506,,23,,"You been tellin' me you're a genius
Since you were seventeen
In all the time I've known you
I still don't know what you mean
The weekend at the college
Didn't turn out like you planned
The things that pass for knowledge I can't understand.",Reelin' in the Years,Steely Dan,https://www.youtube.com/watch?v=_bwHK1xkgJA#t=1m14s,1970s,Pop,1972,
507,,28,,"I've been angry and sad about things that you do
I can't count all the times that I've told you we're through
And when you go, when you slam the door
I think you know that you won't be away too long
You know that I'm not that strong
Just one look and I can hear a bell ring
One more look and I forget everything, whoa",,"Benny Andersson, Björn Ulvaeus and Stig Anderson (Sung by Abba)",https://youtu.be/unfzfe8f9NI?t=81,1970s,Pop,1974,
508,,1,,"Music knows that it is and always will
Be one of the things that life just won't quit
But here are some of music's pioneers
That time will not allow us to forget now
For there's Basie, Miller, Satchmo...and with a voice like Ella's ringing out
There's no way the band could lose",Sir Duke,Stevie Wonder,https://youtu.be/s6fPN5aQVDI?t=81,1970s,Pop,1976,
509,,27,,"Well, the names have all changed
Since you hung around
But those dreams have remained
And they've turned around
Who'd have thought they'd lead you
(Who'd have thought they'd lead you)
Back here where we need you?
(Back here where we need you?)
Yeah, we tease him a lot
'Cause we got him on the spot",Welcome Back,John Sebastian,https://youtu.be/IhzzAUaOzsk?t=15,1970s,Pop,1976,
510,,26,,"I don't know the reason
Stayed here all season
With nothing to show but this brand new tattoo
But it's a real beauty
A Mexican cutie
How it got here, I haven't got a clue",Margaritaville,Jimmy Buffett,https://youtu.be/tUlf4LvMJus?si=Wv7WOOXC3gnFj56Z&t=113,1970s,Pop,1977,
511,,18,,"Oh, she takes care of herself
She can wait if she wants
She's ahead of her time
Oh, and she never gives out
And she never gives in
She just changes her mind",She's Always A Woman,Billy Joel,https://www.youtube.com/watch?v=Cx3QmqV2pHg#t=0m56s,1970s,Pop,1977,
512,,,,"I come to do my show
You've heard my latest record
It's been on the radio
Ah, it took me years to write it
They were the best years of my life
It was a beautiful song
But it ran too long
If you're gonna have a hit
You gotta make it fit
So they cut it down to 3:05",The Entertainer,Billy Joel,https://www.youtube.com/watch?v=ozDSk9XUkrc#t=2m03s,1970s,Pop,1974,
513,,5,,"I don't own the clothes I'm wearing
And the road goes on forever
And I've got one more silver dollar
But I'm not gonna let 'em catch me, no",Midnight Rider,Gregg Allman & Robert Kim Payne,https://youtu.be/TCRS4DRmf_w?t=44,1970s,Rock,1970,
514,,31,4,"Why do we never get an answer
When we're knocking at the door?
Because the truth is hard to swallow
That's what the wall of love is for.
It's not the way that you say it
When you do those things to me.
It's more the way that you mean it
When you tell me what will be.",Question,Justin Hayward   Sung by Moody Blues,https://youtu.be/NP9iOqdxS8c?t=33,1970s,Rock,1970,
515,,,21,"She was born in the wagon of a travellin' show;
Her mama had to dance for the money they'd throw; Grandpa'd do whatever he could;
​Preach a little gospel, sell a couple bottles of Doctor Good....Picked up a boy just south of Mobile
Gave him a ride, filled him with a hot meal. I was 16, he was 21, Rode with us to Memphis
And papa woulda shot him if he knew what he'd done","Gypsys, Tramps and Thieves",Cher,https://youtu.be/TOSZwEwl_1Q?t=99,1970s,Rock,1971,
516,,2,,"Cause I have wandered through this world. And as each moment has unfurled. I've been waiting to awaken from these dreams. People go just where they will. I never noticed them until I got this feeling, that it's later than it seems.",Doctor My Eyes,Jackson Browne,https://www.youtube.com/watch?v=qKGTaplzmV4#t=0m59s,1970s,Rock,1972,
517,,,36,"I've had bad dreams too many times, To think that they don't mean much any more. Fine times have gone and left my sad home, Friends who once cared just walk out my door.",Love Has No Pride,"Libby Titus & Eric Kaz
Sung by Bonnie Raitt",https://youtu.be/S2QTdxXmd0k?t=3,1970s,Rock,1972,
518,,47,,"Asia's crowded and Europe's too old
Africa is far too hot and Canada's too cold
And South America stole our name
Let's drop the big one
There'll be no one left to blame us
We'll save Australia
Don't wanna hurt no kangaroo
We'll build an All American amusement park there
They got surfin too",Political Science,Randy Newman,https://youtu.be/Kg_LDeUEiWY?t=45,1970s,Rock,1972,
519,,,5,"And the piano it sounds like a carnival and the microphone smells like a beer
and they sit at the bar and put bread in my jar, and say,
​""Man, what are you doing here?""",Piano Man,Billy Joel,https://youtu.be/gxEPV4kolz0?t=269,1970s,Rock,1973,
520,,23,,"Someday we'll look back on this and it will all seem funny, But now you're sad, your mama's mad And your papa says he knows that I don't have any money. Your papa says he knows that I don't have any money. Oh, your daddy says he knows that I don't have any money, Well, tell him this is his last chance to get his daughter in a fine romance 'Cause a record company, just gave me a big advance.",Rosalita,Bruce Springsteen,https://www.youtube.com/watch?v=CYHGh6lmSbo#t=4m51s,1970s,Rock,1973,
521,,13,,"If I had a box just for wishes
And dreams that had never come true
The box would be empty except for the memory
Of how they were answered by you",Time In A Bottle,Jim Croce,https://youtu.be/dO1rMeYnOmM?t=88,1970s,Rock,1972,
