,Uploaded (decade),Uploaded (genre),Songs Potpourri,Lyrix,Song name,Artist,Youtube Link,Decade,Genre,Year,Contributed by
1323,,96,,"I'll be alone each and every night. While you're away, don't forget to write. Bye-bye, so long, farewell Bye-bye, so long. See you in September See you when the summer's through. Here we are (bye, baby, goodbye). Saying goodbye at the station. Summer vacation Is taking you away.",DOUBLE FEATURE See You in September,Sung by The Happenings and for a Roy Rogers Restaurant ad (1988) Sid Wayne & Sherman Edwards ,https://youtu.be/7JQS6H2AXdM?si=99ELHKD3dtCH67o6   https://youtu.be/pCR-uHlJl_I?si=22v_gKBK8R7jsvX-,1960s,Pop,1966,
1324,,91,,"Don't come a hangin' around my door
Don't want to see your face no more
I don't need your war machines
I don't need your ghetto scenes
Colored lights can hypnotize
Sparkle someone else's eyes
Now woman, get away from me
American woman, mama let me be",American Woman,"Burton Cummings, Garry Peterson,nJim Kale & Randy Bachman Sung by Guess Who ",https://youtu.be/gkqfpkTTy2w?si=V4PDS68LXgVQxd_u&t=156,1970s,Rock,1970,
1325,,105,,"Walkin' with my baby, she got great big feet
She long, lean and lanky
And ain't had nothing to eat
But she's my baby
And I love her just the same
Crazy 'bout that woman 'cause Caldonia is her name",Caldonia,Louis Jordan & Fleecie Moore,https://youtu.be/PR6pHtiNT_k?si=cumfr_ihUiXRvJvV&t=48,Vintage,Jazz/Blues/RnB,1945,
1326,83,,,"Headin' for the station with a pack on my back
I'm tired of transportation in the back of a hack
I love to hear the rhythm of the clickety-clack
And hear the lonesome whistle, see the smoke from the stack
And pal around with democratic fellas named Mac
So take me right back to the track, Jack",DOUBLE FEATURE Choo Choo Ch'Boogie,"Sung by Louis Jordan and by Asleep At The Wheel Vaughn Horton, Denver Darling, and Milt Gabler.",https://youtu.be/_A2pRVyBmOY?si=5aYXtoKoyFghY4LF&t=12. https://youtu.be/RTK8Fc1wh_k?si=VjzoV9aTCQqotRN6&t=19,Vintage,Jazz/Blues/RnB,1946,
1327,,106,,"This train is a clean train, Everybody ride it in Jesus' name. ..This train don't carry nothing but the righteous and the holy. This train don't carry no gamblers, this train;
This train don't carry no gamblers, this train;
This train don't carry no gamblers,
Liars, thieves, nor big shot ramblers,
This train is bound for glory, this train.",DOUBLE FEATURE This Train (This Train Is Bound for Glory),"Sung by Sister Rosetta Tharpe and by ROY ORBISON, JOHNNY CASH, CARL PERKINS & JERRY LEE LEWIS",https://youtu.be/Z6L5grLqkA0?si=CW8K26aBpuGlzg2r&t=46. https://youtu.be/KKsDQaTkkxo?si=0QXZW0x0sAlxTfnB&t=12,Vintage,Jazz/Blues/RnB,1922,
1328,84,,,"I've lost all ambition
For worldly acclaim
I just want to be the one you love
And with your admission
That you feel the same
I'll have reached the goal I'm dreaming of
Believe me
I don't want to set the world on fire
I just want to start
A flame in your heart",I don't want to set the world on fire,"Sung here by The Ink Spots  Bennie Benjamin, Eddie Durham, Sol Marcus and Eddie Seiler.",https://youtu.be/6l6vqPUM_FE?si=oteatCn9YHNO7eE4&t=48,Vintage,Jazz/Blues/RnB,1938,
1329,,98,,"You always hurt the one you love
The one you shouldn't hurt at all
You always take the sweetest rose
And crush it till the petals fall",DOUBLE FEATURE You Always Hurt the One You Love,"Sung by Mills Brothers and by Spike Jones. Allan Roberts, Doris Fisher",https://youtu.be/mS9U75YC-jA?si=u0MySXn6ViUGs_7S&t=3. https://youtu.be/78WXVOG2ABM?si=307fyoFXuv7M_3Yr&t=120,Vintage,Pop,1944,
1330,94,,,"I build my house up on this rock, baby
Every day with you
There's nothin' in that town I need
After everything we've been through
Me out in my garden and you out on your walk
Is all the distance this poor girl can take
Without listenin' to you talk
I don't need their money, baby
Just you and me on the rock",You and Me on the Rock,"Sung by Brandi Carlile with Lucius on Saturday Night Live Brandi Carlile, Phil & Tim Hanseroth",https://youtu.be/ShbRWWnybKA?si=QBqInXoZwizFdp1z&t=41,2010s,Alternative/Indie,2022,
1331,,99,,"Turn back time, help me to rewind and we can
Find ourselves again
It's not too late
Either way, I lose you in these silent days
It wasn't right
But it was right on time",Right on Time,"Sung by Brandi Carlile at 64th Grammy Awards. Brandi Carlile, Dave Cobb, Phil & Tim Hanseroth",https://youtu.be/cE2I-MXYbKI?si=TQxE8m1wQOM72Alz&t=69,2010s,Pop,2021,
1332,,80,,"That sun is hot and that old clock is moving slow
And so am I
The workday passes like molasses in wintertime
But it's July
I'm getting paid by the hour and older by the minute
My boss just pushed me over the limit
I'd love to call him something, but I think I'll just call it a day",It's 5 O'clock Somewhere,"Sung by Jimmy Buffett. Jim ""Moose"" Brown & Don Rollins",https://youtu.be/5BMv9Ngc-kw?si=Nu3u048L5LKcP1Gm&t=10,2000s,Country,2003,
1333,,84,,"Goodbye to my Juan, goodbye Rosalita
Adios mis amigos, Jesus y Maria
You won't have a name when you ride the big airplane
All they will call you will be deportees",Deportee (Plane Wreck at Los Gatos),Sung here by Joan Baez Woody Guthrie & Martin Hoffman,https://youtu.be/mmN2nodeHuk?si=lcLQ4R9A0gAinmwz&t=55,Vintage,Folk/Protest,1948,
1334,,83,,"Well, earlier tonight you hurried up to go on your big date
And in your haste you left a lot of dirty forks and knives and plates
And as you sit here listening to this stupid song
On your kitchen table there's a party going on
And when you get home late tonight
Open the door and turn on your light
And you will see your wallpaper change those are cockroaches on parade!",Cockroaches on Parade,Harry Waller,https://youtu.be/AYrVHSRjiSk?si=w1Xxkz5W6LAW0JXH&t=111,1970s,Folk/Protest,1978,
1335,64,,,"So we're okay
We're fine
Baby I'm here to stop your crying
Chase all the ghosts from your head
I'm stronger than the monster beneath your bed
Smarter than the tricks played on your heart
We'll look at them together then we'll take them apart
Adding up the total of a love that's true
Multiply life by the power of two",Power of Two,Sung by Indigo Girls Amy Ray and Emily Saliers,https://youtu.be/hj0yVN8pFNw?si=20_5KCS-icnOJnao&t=51,1990s,Country,1994,
1336,,100,,"Think, what a big man he'll be
Think, all the places you'll see
Now think what the future would be
With a poor boy like me
Dawn go away, please go away
Although I know I want you to stay",Dawn (Go Away),Four Seasons. Bob Gaudio and Sandy Linzer,https://youtu.be/9AywFSEc2Qg?si=Ta8keVe7LzWQNtnw&t=38,1960s,Pop,1964,
1337,,81,,"On this land we put our brand, Cartwright is the name, fortune smiled, the day we filed the Ponderosa claim.
Here in the West, we're livin' the best, Bonanza
If anyone fights any one of us, he's got a fight with me
Bonanza
",Bonanza,Sung by Lorne Greene. Jay Livingston and Raymond Evans,https://youtu.be/AMFrYmkfweM?si=07PPhOL8ijYlpFND&t=37,1960s,Country,1961,
1338,,81,,"My daddy was a miner
And I'm a miner's son
He'll be with you fellow workers
​Until the battle's won",Which Side Are You On?,Sung by Pete Seeger. Florence Reece,https://youtu.be/9XEnTxlBuGo?si=oc5X6tbwZoJR_N5E&t=51,Vintage,Folk/Protest,1931,
1339,,84,,"I learned our government must be strong;
It's always right and never wrong!
Our leaders are the finest men
And we elect them again and again,
And that's what I learned in school today,
That's what I learned in school",What Did You Learn in School Today?,"Sung here by Dru Martin, Phil Gutowski & Dick Clark. Tom Paxton",https://youtu.be/9It2uX0qT5s?si=Psd6brwJiAMrK-9L&t=115,1960s,Folk/Protest,1964,
1340,,97,,"In a little café
Just the other side of the border
She was a-sitting there a-givin' me
Looks that made my mouth water
So I started walking her way
She belonged to bad man, José
And I knew, yes I knew I should leave
When I heard her say, yeah",Come a Little Bit Closer,"Sung by Jay and the Americancs  Tommy Boyce, Bobby Hart, Wes Farrell (Span subtitles)",https://youtu.be/ogft7bKj9HI?si=v39cDn7jvvjP8ILl&t=8,1960s,Pop,1964,
1341,,85,,"About that time two young n' lovely girls just happened by
One says to the other with a twinkle in her eye
""See yon sleeping Scotsman so strong and handsome built
I wonder if it's true what they don't wear beneath the kilt""
Ring-ding-did-a-little-la-di-oh, ring-di-diddly-eye-oh
I wonder if it's true what they don't wear beneath the kilt",The Scotsman,Sung by Bryan Bowers. Mike Cross,https://youtu.be/v0NZY9MBK7Y?si=l4nQ2hwMsInxdY8_&t=25,1970s,Folk/Protest,1975,
1342,,101,,"Just give me a reason, just a little bit's enough
Just a second we're not broken just bent and we can learn to love again
I never stop, you're still written in the scars on my heart
You're not broken, just bent, and we can learn to love again",Give Me A Reason,Pink w/ Nate Reuss,https://youtu.be/OpQFFLBMEPI?si=CZKHjO3580PvkrCH&t=49,2010s,Pop,2012,
1343,95,,,"Where there is desire, there is gonna be a flame
Where there is a flame, someone's bound to get burned
But just because it burns doesn't mean you're gonna die
You've gotta get up and try, try, try",Try ,Pink,https://youtu.be/yTCDVfMz15M?si=ckspJAfrvifmc7A5&t=49,2010s,Pop,2012,
1344,78,,,"So, so what?
I'm still a rock star
I got my rock moves
And I don't need you
And guess what?
I'm having more fun
And now that we're done
I'm gonna show you tonight",So What,Pink,https://youtu.be/FJfFZqTlWrQ?si=OC4H4gu3xiqRwh1i&t=32,2000s,Pop,2008,
1345,,,99,"Picture a place, somewhere else far away
Where you know what they mean, and they mean what they say
To us and would that be enough?
Are we running out of time?
Are we hiding from the light?
Are we just too scared to fight
For what we want tonight?",Trustfall,Pink,https://youtu.be/D2KE2a5qo0g?si=bq_1e9fCqknZHQQ2&t=32,2010s,Pop,2023,
1346,,100,,"I'll march my band out
I'm beating my drum
And if I'm fanned out
Your turn at bat, sir
At least I didn't fake it
Hat, sir, I guess I didn't make it
Get ready for me, love
'Cause I'm a ""comer""
I simply gotta march
My heart's a drummer",Don’t Rain on My Parade from musical Funny Girl,Sung by Barbra Streisand Bob Merrill & Jule Styne,https://youtu.be/emdaIJeVoTQ?si=3OhqbWkUJEsv5tO2&t=128,1960s,Musical/Movie,1964,
1347,,,100,"Love, soft as an easy chair
Love, fresh as the morning air
One love that is shared by two
I have found with you",Evergreen from movie A Star Is Born,Barbra Streisand,https://youtu.be/udLeOOy6em4?si=8szzDV8EF6AhTbiq&t=16,1970s,Musical/Movie,1976,
1348,,102,,"Lovers, are very special people
They're the luckiest people in the world
With one person
One very special person
A feeling deep in your soul
Says you were half now you're whole
No more hunger and thirst",People,Sung by Barbra Streisand. Bob Merrill & Jule Styne,https://youtu.be/fPlQ6EtArSc?si=Cans7bLUjlOOzSfl&t=77,1960s,Pop,1964,
1349,61,,,"When you feel like the only kid in town without a Christmas tree
Here's a list of people who are Jewish just like you and me
David Lee Roth lights the menorah
So do James Caan, Kirk Douglas, and the late Dinah Shore-ah
Guess who eats together at the Carnegie Deli
Bowser from Sha Na Na and Arthur Fonzerelli
Paul Newman's half Jewish, Goldie Hawn's half too
Put them together, what a fine lookin' Jew",The Chanukah Song,"Sung by Adam Sandler. sandler, Lewis Morton and Ian Maxtone-Graham",https://youtu.be/qUCNAnp2QAI?si=YEIAauiwgVinX7ZU&t=64,1990s,Alternative/Indie,1994,
1350,104,,,"White bird
In a golden cage
Alone
The leaves blow
Across the long, black road
To the darkened skies
In its rage",White Bird,Sung by It's A Beautiful Day. David and Linda LaFlamme,https://youtu.be/q918fs4RAto?si=020S4Vs9MRYCjR7x&t=55,1960s,Rock,1969,
1351,,103,,"Young man, are you listening to me?
I said, young man, what do you want to be?
I said, young man, you can make real your dreams
But you got to know this one thing
No man does it all by himself
I said, young man, put your pride on the shelf
And just go there, to the Y.M.C.A
I'm sure they can help you today",Y.M.C.A. ,Sung by Village People Jacques Morali & Victor Willis,https://youtu.be/CS9OO0S5w2k?si=_h4lAhghEq9A4dmy&t=74,1970s,Pop,1978,
1352,85,,,"Just finish cleanin' up your room
Let's see that dust fly with that broom
Get all that garbage out of sight
Or you don't go out Friday night
Yakety yak (don't talk back)",Yakkity Yak,Sung by The Coasters. Jerry Leiber & Mike Stoller,https://youtu.be/HRA3majpFXI?si=3W6vcV_-Dopb_t69&t=14,Vintage,Rock,1959,
1353,,,101,"Anger and lust my senses running amok
Bewildered and deluded, have I been hit by a truck?
When my tongue lay inside his lip
Felt like the time in the womb
But I woke up with a headache that split my skull
Alone in the room",Up The Neck,Sung by The Pretenders. Chrissie Hynde,https://youtu.be/ALXE0YNqRgI?si=GtMkWW32idDd2wy5&t=24,1970s,Rock,1979,
1354,65,,,"Well I'm a lot like you
When you're standing at the crossroads
And don't know which path to choose
Let me come along
'Cause even if you're wrong
I'll stand by you",I'll Stand By You,Sung by The Pretenders. Chrissie Hynde,https://youtu.be/bLpmj059JFA?si=k7PiYr3EwrEhSCqG&t=96,1990s,Alternative/Indie,1994,
1355,,92,,"Gonna use my arms
Gonna use my legs
Gonna use my style
Gonna use my sidestep
Gonna use my fingers
Gonna use my, my, my, imagination",Brass in Pocket,Sung by The Pretenders. Chrissie Hynde & James Honeyman-Scott,https://youtu.be/0H6re3PCP3E?t=41,1970s,Rock,1979,
1356,,107,,"You told me you was high-class 
But I could see through that (or But that was just a lie)
Yes, you told me you was high-class
But I could see through that
And daddy, I know You ain't no real cool cat (or Yeah, you ain't never caught a rabbit
And you ain't no friend of mine)
",DOUBLE FEATURE Hound Dog,Sung by Big Mama Thornton & by Elvis Presley. Jerry Leiber and Mike Stoller,https://youtu.be/DO1eMzRVjII?si=nVtNSIBHSPCyGSwz&t=24. https://youtu.be/lzQ8GDBA8Is?si=0EOA8Ba3Jj7pQGVV&t=16,Vintage,Jazz/Blues/RnB,1953,
1357,84,,,"No New Year's Day to celebrate
No chocolate covered candy hearts to give away
No first of spring, no song to sing
In fact, here's just another ordinary day",DOUBLE FEATURE I Just Called to Say I Love You,Sung by Stevie Wonder & by John Prine Stevie Wonder,https://youtu.be/VtPLdL5GWDg?si=pQo09G6wAnEp1RTH&t=5.  https://youtu.be/e3o3_bhPFho?si=A6zdN-85ECrsls0w&t=4,1980s,Jazz/Blues/RnB,1984,
1358,,82,,"There's a hole in daddy's arm where all the money goes
Jesus Christ died for nothin' I suppose
Little pitchers have big ears
Don't stop to count the years
Sweet songs never last too long on broken radios",Sam Stone,John Prine,https://youtu.be/rtrALjg0-xQ?si=MxWFT5AkDE065LlX&t=105,1960s,Country,1971,
1359,,108,,"Sweeter than wine (sweeter than wine)
Softer than a summer night (softer than a summer night)
Everything I want to have (everything, everything)
Whenever I hold you tight",DOUBLE FEATURE This Magic Moment,Sung by The Drifters & by Jay and the Americans. Doc Pomus and Mort Shuman,https://youtu.be/Ul041CSNJto?si=Rv_X8buB8OVqv6Nk&t=38.   https://youtu.be/WpePWo56zm4?si=TYXcC_XeOrg5P1H1&t=45,1960s,Jazz/Blues/RnB,1960,
1360,95,,,"Magnified, sanctified, be thy holy name
Vilified, crucified, in the human frame
A million candles burning for the help that never came
You want it darker
Hineni, hineni
I'm ready, my lord",You Want It Darker,Leonard Cohen,https://youtu.be/XQOpeJ8YHrE?si=QbTCEKzTX_XVbzns&t=53,2010s,Folk/Protest,2016,
1361,,86,,"And who by fire, who by water
who in the sunshine, who in the night time
who by high ordeal, who by common trial
who in your merry, merry month of May
who by very slow decay
and who shall I say is calling?",Who By Fire,Leonard Cohen,https://youtu.be/251Blni2AE4?si=ce-y5K7Kkr1fCyaq&t=124,1970s,Folk/Protest,1974,
1362,,87,,"Down the rock island line she's a mighty good road
The rock island line is the road to ride
Yes, The rock island line is a mighty good road
And if you want to ride you gotta ride it like you find it
Get your ticket at the station on the rock island line",DOUBLE FEATURE Rock Island Line,Sung here by Johnny Cash & by Harry Belafonte Clarence Wilson,https://youtu.be/4wR-NS8XOaM?si=ZMCTZ2EVaVUWma2A&t=125.  https://youtu.be/vpLbHocruJg?si=IotrBcAz76Meh3pQ&t=40,Vintage,Folk/Protest,1929,
1363,82,,,"There's a dark and a troubled side of life
There's a bright and a sunny side too
Though we meet with the darkness and strife
The sunny side we also may view",Sunny Side of Life,Sung by Carter family. Ada Blenkhorn ,https://youtu.be/ZbmQQ4RfzVE?si=CCg4yesYnCo_F3rQ&t=16,Vintage,Jazz/Blues/RnB,1899,
1364,,88,,"Daddy’s been gone
Gone for so long
For him I pray
He joined the Corps
Fighting a war
Somewhere far away.
He promised me he’d return
When the Chanukah candles burn
So here I wait
The blessings I recite
By the candle-light
But it’s getting late.",Daddy Come Home,Sung by Yaakov Mordechai Gerstner & The Yeshiva Boys Choir Yossi Toiv & Eli Gerstner,https://youtu.be/xF7UVW6PLig?si=HJf5Z1kMKdFHN_P0&t=17,2010s,Folk/Protest,2010,
1365,,83,,"I knew
You'd love me as long as you wanted
And then someday
You'd leave me for somebody new
Worry
Why do I let myself worry?
Wondering
What in the world did I do
Oh, crazy
For thinking that my love could hold you",Crazy,Sung by Patsy Cline. Willie Nelson,https://youtu.be/MbnrdCS57d0?si=r6y7iRHjbpSnDEOy&t=39,1960s,Country,1961,
1366,,89,,"Now the Sunday has come and the Sunday has gone
And we can't do much more than to sing you a song
We'll sing it so loudly, you better sing along
And the choirs keep singing of freedom",DOUBLE FEATURE Birmingham Sunday,Sung by Joan Baez and by Rhiannon Giddens   Richard Fariña,https://youtu.be/WQ0y-vO9QLE?si=TeMmfKGy7kWYOOKt&t=268. https://youtu.be/2Coe9TpSZHc?si=d5HaEn-oZqs60Ews&t=255,1960s,Folk/Protest,1964,
1367,87,,,"It rained 40 days, 40 nights without stopping
Noah was glad when the rain stopped dropping
Knock at the window, a knock at the door
Crying brother Noah can't you take on more
Noah cried no, you're full of sin
God got the key and you can't get in
Just listen how it's rainin'
Will you listen how it's rainin'",Didn't It Rain,Sister Rosetta Tharpe,https://youtu.be/Y9a49oFalZE?si=OelNirso3DxUnZnA&t=111,Vintage,Jazz/Blues/RnB,1919/1964,
1368,78,,,"It’s a long, long way from where we’ve been
The here and now is better than it was back then
Today may break your heart, but tomorrow holds the key
We’ve come so far, but the best is yet to be",Yet To Be,Rhiannon Giddens  Sung w/ Jason Isbell,https://youtu.be/eCQ3qm_JCVo?si=TReY4QaBbGRJjNUc&t=99,2010s,Alternative/Indie,2023,
1369,,109,,"Mama, dear mama, come and stand by me
I feel a lightness in my feet, a longing to be free
My heart it is a-shakin' with an old, old song
I hear the voices sayin', it's time for moving on
She took her mama by the hand, they rose up in the air
They held each other tight and then
They flew away from there",We Could Fly,Rhiannon Giddens,https://youtu.be/Q6fAD90KXFg?si=ZBt5w3jdbcgfD3GD&t=293,2010s,Jazz/Blues/RnB,2017,
1370,,84,,"If you can't tell how good it is
Well, you won't know what you're missing
You're good, but I'll find better
And they'll be without your bitching
If you don't know how sweet it is
Get on out of my kitchen",If You Don't Know How Sweet It is,Rhiannon Giddens,https://youtu.be/YK9e8Mr4-9c?si=Gk_214S7wg-M4M39&t=10,2010s,Country,2023,
1371,,110,,"Ah, you can talk about the pit, barbecue
The band was jumpin', the people too
Ah, mess around
They doin' the mess around",Mess Around,Ray Charles. Ahmet Ertegun,https://youtu.be/tk_xapZSO6g?si=5lcVVHvQtSSIp6UX&t=20,Vintage,Jazz/Blues/RnB,1953,
1372,,104,,"Just got a job on the railroad (diddy-dumb-dum)
The work is hard and long (diddy-um-dum)
But I'm gonna build us a future
And show your Daddy he's wrong
Meet me at midnight, Mary, same place we always go
Meet me at midnight, Mary, and don't let anyone know",Midnight Mary,Joey Powers Sung by (Joseph Ruggiero). Artie Wayne and Ben Raleigh,https://youtu.be/SVOL8OhzmDI?si=vOu6PVruwkiOkw5i&t=56,1960s,Pop,1964,
1373,88,,,"Train I ride, sixteen coaches long
Train I ride, sixteen coaches long
Well, that long black train got my baby and gone",QUADRUPLE FEATURE Mystery Train,Sung by Junior Parker & by Elvis Presley & by The Band & by Jerry Garcia Band,https://youtu.be/n2AkEqMHlfg?si=ORLhQKHCvK2JZJn9&t=2. https://youtu.be/Wdqh5sEZe9Y?si=viR6CfjQbZWT8f9H&t=2 https://youtu.be/rQFE113iDx4?si=wKTOaLG7Kt80igK7&t=27. https://youtu.be/lzGYBdhlxmg?si=vSde_5IOnzVDQQ2W&t=81,Vintage,Jazz/Blues/RnB,1953,
1374,,86,,"When I feel that chill, smell that fresh cut grass
I'm back in my helmet, cleats, and shoulder pads
Standing in the huddle listening to the call
Fans going crazy for the boys of fall
They didn't let just anybody in that club
Took every ounce of heart and sweat and blood
To get to wear those game day jerseys down the hall
Kings of the school man, we're the boys of fall",Boys of Fall,Sung by Kenny Chesney. Casey Beathard and Dave Turnbull,https://youtu.be/3LG0KVPh4Ak?si=wRAYCPbhWGPn4ejT&t=1,2010s,Country,2010,
1375,,87,,"Oh, but here it is October
Oh the leaves are turning gold
Each night a little bluer
But autumns not that cold
I know before too long
I'll feel the chill that winter brings",Autumn's Not That Cold,Sung by Lorrie Morgan. Skip Ewing & Max D. Barnes,https://youtu.be/zSvdw6kLOOs?si=Ffxx6OMy_rM-gSQP&t=107,1990s,Country,1991,
1376,73,,,"I sung a lullaby every night
Sung for my Ava every night
Ava was the morning, now she's gone
She's reborn like Sarah Vaughan
In the sanctuary she has found
Birds surround her sweet sound
And Ava flies in paradise",October Song,"Sung by Amy Winehouse Winehouse, Matt Rowe & Stefan Skarbek",https://youtu.be/8Cutj-myERU?si=OTxGeCNURzbXdGAh&t=43,2000s,Jazz/Blues/RnB,2003,
1377,,85,,"It was the 14th of October
And that t-shirt off your shoulder
I was drunk, said I was sober
And you said ""yeah, right""
We were talkin' for a minute
Then some guy tried to cut in
You took my hand and we pretended
Like I was your guy",Unforgettable,"Sung by Thomas Rhett. Thomas Rhett, Jesse Frasure, Ashley Gorley & Shane McAnally",https://youtu.be/_T8ml-P0GkI?si=KLibCtjTy_b9PQnR&t=5,2010s,Country,2017,
1378,86,,,"When October goes
The snow begins to fly
Above the smoky roofs
I watch the planes go by
The children running home beneath
A twilight sky
Oh, for the fun of them
When I was one of them",When October Goes,Sung by Rosemary Clooney Barry Manilow & Johnny Mercer,https://youtu.be/RediYWaf_fQ?si=4e_nOXc9o2YfP4qG&t=8,1980s,Pop,1984,
1379,85,,,"Wise on a birthday party in a world full of surprising fireworks
And sudden silence shhh
Lying on a stranger's bed ,the new day breaks like a speeding train or an old friend
Ever expected but never knocking
Holding your own in a battered car all night. Parties, cocktail bars
And smile when the butterfly escapes the killing jar
Sure eyes awake before the dancing is over wise or naked in secret Oktober",Secret Oktober,"Sung by Duran Duran. Simon Le Bon, John, Roger & Andy Taylor & Nick Rhodes",https://youtu.be/2aAz9IPKKvc?si=iZjKHW_QvjoVWYOz&t=1,1980s,Alternative/Indie,1983,
1380,89,,,"Ein Prosit, ein Prosit
Der Gemütlichkeit
Ein Prosit, ein Prosit
Der Gemütlichkeit Eins, zwei, drei,  g'suffa",I Salute You (Ein Prosit),Georg Kunoth,https://youtu.be/6Xe7mRV0S-0?si=VlpFTSaYLsHVRmuZ&t=1,Vintage,Pop,trad.,
1381,,93,,"Just take those old records off the shelf
I'll sit and listen to 'em by myself
Today's music ain't got the same soul
I like that old time rock 'n' roll
Don't try to take me to a disco
You'll never even get me out on the floor
In ten minutes I'll be late for the door",Old Time Rock and Roll,Sung by Bob Seger/Risky Business w/ Tom Cruise George Jackson and Thomas E. Jones III & Seger,https://youtu.be/PXwF7g5wksQ?si=YmaSm3MDrtQDnXvI&t=1,1970s,Rock,1978,
1382,,101,,"Dragonfly out in the sun, you know what I mean, don't you know
Butterflies all havin' fun, you know what I mean
Sleep in peace when day is done, that's what I mean
And this old world is a new world
And a bold world
For me",Feelin' Good,Sung by Nina Simone. Anthony Newley and Leslie Bricusse for the musical The Roar of the Greasepaint – The Smell of the Crowd,https://youtu.be/oHRNrgDIJfo?si=2KPiLB45CfGWFuw_&t=82,1960s,Musical/Movie,1965,
1383,90,,,"I got a gal, named Daisy, she almost drives me crazy
Got a gal, named Daisy, she almost drives me crazy
She knows how to love me, yes indeed
Boy you don't know what she do to me",Tutti Frutti,Little Richard and Dorothy LaBostrie,https://youtu.be/ivhauEr3KxU?si=60HBwUpdfeSvVkFO&t=46,Vintage,Rock,1955,
1384,91,,,"I wanna squeeze her but I'm way too low
I would be runnin' but my feet's too slow
A young man rhythm got a hold of me too
I got the rockin' pneumonia
And a boogie woogie flu",Rockin' Pneumonia and the Boogie Woogie Flu,"Huey ""Piano"" Smith & Johnny Vincent",https://youtu.be/KKjhLq4NXIE?si=aeksyaNd6OPsy-7W&t=35,Vintage,Rock,1957,
1385,92,,,"Love is a losing game
Love can a be shame
I know of a fool
You see
For that fool is me
Tell me why, why, why
Tell me why
Why do birds sing so gay?
And lovers await the break of day?
Why do they fall in love?",Why Do Fools Fall in Love,"Sung by Frankie Lymon & the Teenagers. Frankie Lymon, Herman Santiago & Jimmy Merchant",https://youtu.be/lU9Q7hEhQjY?si=y37b24cq7mMev7pc&t=35,Vintage,Rock,1956,
1386,,105,,"So you lie awake
Just singing the blues all night
Goody goody!
So you think that love's a
Barrel of dynamite
Hurray and hallelujah!
You had it coming to ya
Goody goody for him
Goody goody for me
And I hope you're satisfied
You rascal you... hey!",Goody Goody,Sung by Peggy Lee. Matty Malneck & Johnny Mercer,https://youtu.be/aMRcCJRe1A4?si=1kkdogbLOHfCrzey&t=42,Vintage,Pop,1936,
1387,97,,,"Walk that line
(Torn apart) Torn apart
Gotta spend your whole life trying
(Ride that train) Ride that train
(Free your heart) And free your heart
It's midnight up in Harlem",Midnight in Harlem,"Sung by Tedeschi Trucks Band. Mike Mattison, & Derek Trucks",https://youtu.be/6GkdCiqsFUI?si=fVhpKtgxPGeR6cbK&t=166,2010s,Jazz/Blues/RnB,2011,
